{
  "memo_key": "deadbeefdeadbeefdeadbeefdeadbeefdeadbeefdeadbeefdeadbeefdeadbeef",
  "tree_hash": "cafebabecafebabecafebabecafebabecafebabecafebabecafebabecafebabe",
  "def_digest": "a1b2c3d4e5f6a1b2c3d4e5f6a1b2c3d4e5f6a1b2c3d4e5f6a1b2c3d4e5f6a1b2",
  "toolchain_digest": "1234567890abcdef1234567890abcdef1234567890abcdef1234567890abcdef",
  "exit": 0,
  "artifacts": [
    {
      "path": "target/debug/hugit",
      "digest": "fedcba9876543210fedcba9876543210fedcba9876543210fedcba9876543210"
    }
  ],
  "stdout_ref": "0102030405060708090a0b0c0d0e0f101112131415161718191a1b1c1d1e1f20",
  "stderr_ref": "2122232425262728292a2b2c2d2e2f303132333435363738393a3b3c3d3e3f40",
  "duration_ms": 4200,
  "runner_ref": "runner-01-abc123",
  "produced_at": 1717000000000
}
